{
  "$schema": "http://json-schema.org/draft-06/schema#",
  "type": "object",
  "additionalProperties": false,
  "properties": {
    "$schema": {
      "type": "string"
    },
    "excludeAirlines": {
      "type": "array",
      "description": "Airline codes for airlines which should not be processed (ex. cargo airlines like FX)",
      "items": {
        "type": "string",
        "minLength": 2
      }
    },
    "chaseUnsupportedAirlines": {
      "type": "array",
      "description": "Chase Ultimate Rewards only supports some airlines for booking cash fares, list the ones it doesn't here (ex. WN)",
      "items": {
        "type": "string",
        "minLength": 2
      }
    },
    "airlineGroups": {
      "type": "object",
      "description": "Group name to array of airlines mapping (ex. for use with an airline alliance)",
      "additionalProperties": {
        "type": "array",
        "items": {
          "type": "string",
          "minLength": 2
        }
      }
    },
    "saverBookingClasses": {
      "type": "object",
      "description": "Booking classes list for each airline which should be considered saver fares (and bookable using partners' miles). Supports airlineGroups.",
      "additionalProperties": {
        "type": "array",
        "items": {
          "type": "string",
          "minLength": 1,
          "maxLength": 2
        }
      }
    },
    "airlineAmenities": {
      "type": "array",
      "uniqueItems": true,
      "items": {
        "type": "object",
        "additionalProperties": false,
        "properties": {
          "airlineCode": {
            "type": "string",
            "description": "Airline IATA code (ex. 'UA')"
          },
          "podsAircraft": {
            "type": "array",
            "items": {
              "type": "string"
            },
            "description": "Substrings of aircraft names to assume have lie-flat seats in Business (ex. 'A321'). Use '*' to match all aircrafts by the airline."
          },
          "wifiAircraft": {
            "type": "array",
            "items": {
              "type": "string"
            },
            "description": "Substrings of aircraft names to assume have wifi (ex. 'A321'). Use '*' to match all aircrafts by the airline."
          }
        },
        "title": "AirlineAmenity"
      }
    },
    "scrapers": {
      "type": "array",
      "uniqueItems": true,
      "items": {
        "type": "object",
        "additionalProperties": false,
        "properties": {
          "name": {
            "type": "string",
            "description": "Name of the scraper (ex. 'united')"
          },
          "disabled": {
            "type": "boolean",
            "description": "Disables the scraper from being selected"
          },
          "supportedAirlines": {
            "type": "array",
            "uniqueItems": true,
            "items": {
              "type": "string",
              "minLength": 2
            },
            "description": "Codes of the airlines which this scraper searches (ex. 'UA')"
          },
          "nativeAirline": {
            "type": ["string", "null"],
            "description": "Code of the airline which this scraper naturally searches. Results with this ariline will not be assumed to be saver awards."
          },
          "cashOnlyFares": {
            "type": "boolean",
            "default": false,
            "description": "Set this to true to have this scraper be called for all airlines and to convert all fares on a cents-per-mile basis"
          }
        },
        "required": [
          "name",
          "supportedAirlines"
        ],
        "title": "Scraper"
      }
    }
  },
  "required": [
    "scrapers"
  ],
  "title": "ScrapersConfig"
}
