{
  "$schema": "./config.schema.json",
  "airlineAmenities": [
    {
      "airlineCode": "AC",
      "podsAircraft": ["A330", "787", "777"],
      "wifiAircraft": ["A321", "A319", "A320", "E175", "CRJ900", "E90", "777-300", "777-200", "220-300"]
    },
    {
      "airlineCode": "UA",
      "podsAircraft": ["787", "777", "757-200", "767"],
      "wifiAircraft": ["170", "175", "700", "550", "A320", "767-300", "767-400", "777-200", "777-300", "787-8", "787-9", "787-10", "737-700", "737-800", "737-900", "737 MAX", "757-200"]
    },
    {
      "airlineCode": "B6",
      "podsAircraft": ["Mint", "A321"],
      "wifiAircraft": ["*"]
    },
    {
      "airlineCode": "WN",
      "podsAircraft": [],
      "wifiAircraft": ["*"]
    },
    {
      "airlineCode": "AS",
      "podsAircraft": [],
      "wifiAircraft": ["E175", "737-900", "A320", "A321", "737-800", "737-700"]
    },
    {
      "airlineCode": "HA",
      "podsAircraft": []
    }
  ],
  "airlineGroups": {
    "staralliance": ["AC", "JP", "A3", "CA", "AI", "NZ", "NH", "OZ", "OS", "AV", "SN", "CM", "OU", "MS", "ET", "BR", "HO", "LO", "LH", "SK", "ZH", "SQ", "SA", "LX", "TP", "TG", "TK", "UA", "QK"],
    "skyteam": ["AR", "AM", "UX", "AF", "CI", "MU", "OK", "DL", "GA", "AZ", "KQ", "KL", "KE", "ME", "SV", "RO", "VN", "MF"]
  },
  "saverBookingClasses": {
    "staralliance": ["X", "I", "O"],
    "AA": ["T", "U", "X", "Z"],
    "HA": ["T", "D"]
  },
  "excludeAirlines": ["1I", "FX", "KH", "5X", "8C", "KZ", "5Y", "OO", "K4", "NC", "4Y", "D0", "CK"],
  "chaseUnsupportedAirlines": ["WN"],
  "scrapers": [
    {
      "name": "aa",
      "supportedAirlines": ["AA", "UL", "S7", "RJ", "QR", "QF", "MH", "IB", "HA", "AY", "FJ", "9K", "BA", "AS", "TN", "CX"],
      "nativeAirline": "AA"
    },
    {
      "name": "aeroplan",
      "supportedAirlines": ["staralliance", "GF", "EY", "JU", "CX", "G3", "OY", "UL", "UK"],
      "nativeAirline": "AC"
    },
    {
      "name": "alaska",
      "supportedAirlines": ["AS", "EI", "AA", "BA", "CX", "DE", "LY", "EK", "FJ", "AY", "AU", "FI", "JL", "KE", "LA", "KS", "QF", "7H", "SQ"],
      "nativeAirline": "AS"
    },
    {
      "name": "delta",
      "disabled": true,
      "supportedAirlines": ["skyteam", "WS", "VS"],
      "nativeAirline": "DL"
    },
    {
      "name": "jetblue",
      "supportedAirlines": ["B6"],
      "nativeAirline": "B6"
    },
    {
      "name": "skyscanner",
      "disabled": true,
      "supportedAirlines": [],
      "cashOnlyFares": true
    },
    {
      "name": "skiplagged",
      "supportedAirlines": [],
      "cashOnlyFares": true
    },
    {
      "name": "southwest",
      "supportedAirlines": ["WN"],
      "nativeAirline": "WN"
    },
    {
      "name": "united",
      "supportedAirlines": ["staralliance", "EI", "VW", "EN", "AD", "4B", "9K", "WK", "EW", "HA", "HO", "OA", "3M"],
      "nativeAirline": "UA"
    }
  ]
}
